{
    "playTitle": "Chameleon Tales",
    "author": "John Doe",
    "description": "A play about the transformations of life.",
    "acts": [
      {
        "actNumber": 1,
        "actTitle": "The Beginning",
        "scenes": [
          {
            "sceneNumber": 1,
            "sceneTitle": "Opening Scene",
            "setting": "A quiet village at sunrise.",
            "lines": [
              {
                "actor": "Narrator",
                "setting": "Narrator walks center stage.",
                "text": "Once upon a time, in a tranquil village..."
              },
              {
                "actor": "Alice",
                "setting": null,
                "text": "Look, the sun is rising!"
              },
              {
                "setting": "Bob enters from the left."
              },
              {
                "actor": "Bob",
                "setting": null,
                "text": "It’s a beautiful morning indeed."
              },
              {
                "actor": "Bob",
                "text": "A continuation line carries the previous speaker and omits the setting key entirely."
              }
            ]
          }
        ]
      },
      {
        "actNumber": 2,
        "actTitle": "The Transformation",
        "scenes": [
          {
            "sceneNumber": 2,
            "sceneTitle": "The Turning Point",
            "setting": null,
            "lines": [
              {
                "actor": "Alice",
                "setting": "Looks around in awe.",
                "text": "Everything is so different here."
              },
              {
                "actor": "Bob",
                "setting": null,
                "text": "Change is inevitable, my friend."
              }
            ]
          }
        ]
      }
    ]
  }
